abstract_deadline,date,deadline,full_name,link,name,note,location,timezone,rank
None,October 18 2025,2025-07-27 23:59,Hardware and Architectural Support for Security and Privacy,https://haspworkshop.org/2025/index.html,HASP 2025,Co-located with MICRO 2025,"Seoul, Korea",Unknown,Not Ranked
None,September 9 2024,2024-07-05 23:59,Program Analysis and Verification on Trusted Platforms,https://pavetrust.github.io/,PAVeTrust 2024,Collocated with FM,"Milan, Italy",Unknown,Not Ranked
None,February 23 2026,2025-11-16 23:59,Workshop on the Security of Space and Satellite Systems,https://spacesec.info/,SpaceSec 2026,Co-located with NDSS Symposium,"San Diego, California, USA",Unknown,Not Ranked
None,February 27 2026,2025-12-11 23:59,"Workshop on Measurements, Attacks, and Defenses for the Web",https://madweb.work/,MADWeb 2026,Co-located with NDSS Symposium,"San Diego, California, USA",Unknown,Not Ranked
None,February 23 2026,2025-12-10 23:59,Workshop on Security and Privacy in Standardized IoT,https://sdiotsec.github.io/,SDIoTSec 2026,Co-located with NDSS Symposium,"San Diego, California, USA",Unknown,Not Ranked
None,February 23 2026,2025-12-22 23:59,Workshop on SOC Operations and Construction,https://www.ndss-symposium.org/ndss2026/submissions/cfp-wosoc/,WOSOC 2026,Co-located with NDSS Symposium,"San Diego, California, USA",Unknown,Not Ranked
None,February 27 2026,2025-12-10 23:59,Workshop on LLM Assisted Security and Trust Exploration,https://www.ndss-symposium.org/ndss2026/submissions/cfp-last-x/,LAST-X 2026,Co-located with NDSS Symposium,"San Diego, California, USA",Unknown,Not Ranked
None,February 27 2026,2025-12-05 23:59,Symposium on Usable Security and Privacy,https://www.ndss-symposium.org/ndss2026/submissions/cfp-usec/,USEC 2026,Co-located with NDSS Symposium,"San Diego, California, USA",Unknown,Not Ranked
None,February 23 2026,2025-12-15 23:59,"Workshop on Attack Provenance, Reasoning, and Investigation for Security in the Monitored Environment",https://www.ndss-symposium.org/ndss2026/submissions/cfp-prism/,PRISM 2026,Co-located with NDSS Symposium,"San Diego, California, USA",Unknown,Not Ranked
None,August 10–11 2026,2025-12-12 23:59,USENIX WOOT Conference on Offensive Technologies,https://www.usenix.org/conference/woot26/call-for-papers,WOOT 2026,Co-located with USENIX Security; up-and-coming track deadline is Mar 3 (cycle-2),"Baltimore, MD, USA",Unknown,Not Ranked
None,August 10–11 2026,2026-03-03 23:59,USENIX WOOT Conference on Offensive Technologies,https://www.usenix.org/conference/woot26/call-for-papers,WOOT 2026,Co-located with USENIX Security; up-and-coming track deadline is Mar 3 (cycle-2),"Baltimore, MD, USA",Unknown,Not Ranked
None,May 15 2025,2025-02-17 23:59,IEEE/ACM Workshop on the Internet of Safe Things,https://safethings25.ieee-security.org/,SafeThings 2025,Co-located with IEEE S&P 2025,"San Francisco, CA, USA",Unknown,Not Ranked
None,May 19 2026,2026-02-13 23:59,Malicious Software and Hardware in Internet of Things,https://security.ucc.ie/mal-iot2026/,MALIoT 2026,Co-located with ACM International Conference on Computing Frontiers 2026,"Catania, Italy",Unknown,Not Ranked
None,July 4 2025,2025-03-02 23:59,DevSecOps Research and Opportunities,https://spritz.math.unipd.it/events/2025/devSecOpsRO/,DevSecOpsRO 2025,None,"Venice, Italy",Unknown,Not Ranked
None,February 27 2026,2025-12-11 23:59,International Fuzzing Workshop,https://fuzzing-workshop.github.io/,FUZZING 2026,Co-located with NDSS 2026,"San Diego, CA, USA",Unknown,Not Ranked
None,September 16-20 2024,2024-06-29 23:59,Workshop on Security and Artificial Intelligance,https://sites.google.com/view/secai2024,SECAI 2024,Co-located with ESORICS 2024,"Bydgoszcz, Poland",Unknown,Not Ranked
None,October 18 2024,2024-07-18 23:59,Workshop on Attacks and Solutions in Hardware Security,http://ashesworkshop.org/home,ASHES 2024,Co-located with ACM CCS '24,"Salt Lake City, Utah, United States",Unknown,Not Ranked
None,October 18 2024,2024-07-05 23:59,ACM Workshop on Software Supply Chain Offensive Research and Ecosystem Defenses,https://scored.dev/,SCORED 2024,Co-located with ACM CCS '24,"Salt Lake City, Utah, United States",Unknown,Not Ranked
None,September 25 2025,2025-06-30 23:59,Data Privacy Management International Workshop,https://deic.uab.cat/dpm/dpm2025/,DPM 2025,Co-located with ESORICS 2025,"Toulouse, France",Unknown,Not Ranked
None,September 25 2025,2025-06-30 23:59,International Workshop on Cryptocurrencies and Blockchain Technology,http://cbtworkshop.org/,CBT 2025,Co-located with ESORICS 2025,"Toulouse, France",Unknown,Not Ranked
None,December 15-18 2024,2024-10-01 23:59,Workshop on Cyber Threat Intelligence and Hunting,https://cyberhunt2024.cyberhunt.no/,CyberHunt 2024,Co-located with IEEE BigData 2024,"Washington DC, USA",Unknown,Not Ranked
None,December 16-20 2026,2026-07-10 23:59,International Conference on Information Systems Security,https://iciss.in/cfp/,ICISS 2026,None,"CMI Chennai, India",Unknown,Not Ranked
None,June 2 2026,2026-01-31 23:59,ACM Cyber-Physical System Security Workshop,https://cpss26.github.io/,CPSS 2026,Co-located with ACM AsiaCCS,"Bangalore, India",Unknown,Not Ranked
None,June 2 2026,2026-02-13 23:59,International Workshop on Secure and Efficient Federated Learning,https://federated-learning.org/fl-asiaccs-2026/,FL 2026,Co-located with ACM AsiaCCS,"Bangalore, India",Unknown,Not Ranked
None,June 30 2025,2025-02-20 23:59,Workshop on Attackers and Cyber-Crime Operations,https://wacco-workshop.org/,WACCO 2025,None,"Venezia, Italy",Unknown,Not Ranked
None,November 24-26 2026,2026-06-08 23:59,International Workshop on Security,https://www.iwsec.org/2026/index.html,IWSEC 2026,None,"Tokyo, JP",Unknown,Not Ranked
None,December 8 2025,2025-09-17 23:59,Cyber Security Experimentation and Test Workshop,https://cset25.isi.edu/,CSET 2025,Co-located with ACSAC,"Honolulu, Hawaii, USA",Unknown,Not Ranked
None,June 23-26 2026,2026-03-31 23:59,Workshop on Quantum-Secure Networks and Systems,https://qubip.eu/qsns2026/,QSNS 2026,Co-located with IEEE ISCC 2026,"Vilamoura, Algarve, Portugal",Unknown,Not Ranked
None,October 17 2025,2025-07-08 23:59,Research on offensive and defensive techniques in the context of Man At The End (MATE) attacks,https://checkmate-workshop.github.io/,CheckMATE 2025,Co-located with ACM CCS 2025,"Taipei, Taiwan",Unknown,Not Ranked
None,October 17 2025,2025-06-29 23:59,Cyber Security in Cars Workshop,https://acm-cscs.org,CSCS 2025,Co-located with ACM CCS 2025,"Taipei, Taiwan",Unknown,Not Ranked
None,November 5–6 2026,2026-05-01 23:59,EAI International Conference on Security and Privacy in Cyber-Physical Systems and Smart Vehicles,https://smartsp.eai-conferences.org/,SmartSP 2026,None,"Detroit, MI, USA",Unknown,Not Ranked
None,November 5–6 2026,2026-07-16 23:59,EAI International Conference on Security and Privacy in Cyber-Physical Systems and Smart Vehicles,https://smartsp.eai-conferences.org/,SmartSP 2026,None,"Detroit, MI, USA",Unknown,Not Ranked
None,October 17 2025,2025-06-24 23:59,The ACM Cloud Computing Security Workshop,https://ccsw.io/,CCSW 2025,Co-located with ACM CCS 2025,"Taipei, Taiwan, China",Unknown,Not Ranked
None,April 14-16 2026,2025-11-07 23:59,International Conference on Post-Quantum Cryptography,https://pqcrypto2026.irisa.fr/,PQCrypto 2026,Initial submission with abstract required Oct 31st.,"Saint-Malo, France",Unknown,Not Ranked
None,December 8 2025,2025-10-06 23:59,Workshop on AI for Cyber Threat Intelligence,https://waiti-workshop.github.io/,WAITI 2025,Co-located with ACSAC 2025,"Waikiki, Hawaii, USA",Unknown,Not Ranked
None,September 27 2024,2024-07-29 23:59,Topics in Applied Cryptography,https://aleph.fbk.eu/events/TAC2024/,TAC 2024,Co-located with CIFRIS. Paper registration due Jul 25 AoE,"Rome, Italy",Unknown,Not Ranked
None,February 23 2026,2026-01-06 23:59,Workshop on Security and Privacy of Next-Generation Networks,https://www.ndss-symposium.org/ndss2026/submissions/cfp-futureg/,FutureG 2026,Co-located with NDSS Symposium,"San Diego, California, USA",Unknown,Not Ranked
None,August 4-7 2025,2025-03-01 23:59,International Workshop on Cloud Resilience for the Internet of Things,https://www.cloudresiot.com/,CloudResIOT 2025,Co-located with ICCCN 2025.,"Tokyo, Japan",Unknown,Not Ranked
None,June 23-25 2025,2025-01-31 23:59,Workshop on the Economics of Information Security,http://kmlabcw.iis.u-tokyo.ac.jp/weis/2025/,WEIS 2025,None,"Tokyo, Japan",Unknown,Not Ranked
None,July 10 2026,2026-03-10 23:59,International Workshop on Security and Risk in Identity Management,https://st.fbk.eu/events/SeRIM2026/,SeRIM 2026,Co-Located with IEEE European Symposium on Security and Privacy (EuroS&P).,"Lisbon, Portugal",Unknown,Not Ranked
None,June 5-6 2025,2025-03-13 23:59,Crypto Valley Conference on Blockchain Technology 2025,https://cryptovalleyconference.com/call-for-papers,Crypto Valley Conference 2025,None,"Rotkreuz, Switzerland",Unknown,Not Ranked
None,June 25 2026,2026-03-10 23:59,ACM Workshop on Secure and Trustworthy Cyber Physical Systems,https://sites.google.com/view/sat-cps2026/,ACM SaT-CPS 2026,Co-Located with ACM Conference on Data and Application Security and Privacy (CODASPY).,"Frankfurt, Germany",Unknown,Not Ranked
None,June 2 2026,2026-01-20 23:59,ACM ASIA Public-Key Cryptography Workshop,https://iseclab.ec.t.kanazawa-u.ac.jp/en/APKC2026.html,APKC 2026,Co-located with ACM AsiaCCS 2026,"Bangalore, India",Unknown,Not Ranked
None,September 25-26 2025,2025-06-30 23:59,Workshop on Mobile and IoT Security Technologies,https://mist-workshop.github.io/,MIST 2025,Co-located with ESORICS 2025,"Toulouse, France",Unknown,Not Ranked
None,February 3 2026,2025-07-15 23:59,Microarchitecture Security Conference,https://uasc.cc,uASC 2026,None,"Leuven, Belgium",Unknown,Not Ranked
None,February 3 2026,2025-11-04 23:59,Microarchitecture Security Conference,https://uasc.cc,uASC 2026,None,"Leuven, Belgium",Unknown,Not Ranked
None,September 25 2025,2025-06-13 23:59,Workshop on Hardware-Supported Software Security,https://hs3-workshop.github.io/,HS3 2025,Co-located with ESORICS 25.,"Toulouse, France",Unknown,Not Ranked
None,September 11 2025,2025-07-10 23:59,10th IEEE International Workshop on Cyber-Physical Systems Security,https://spritz.math.unipd.it/events/2025/CPS-Sec2025/,CPS-Sec 2025,In conjunction with IEEE CNS,"Avignon, France",Unknown,Not Ranked
None,September 14 2025,2025-07-14 23:59,"Workshop on Open Tools, Interfaces and Metrics for Implementation Security Testing",https://optimist-ose.org/ches25,OPTIMIST 2025,Co-located with CHES 25.,"Kuala Lumpur, Malaysia",Unknown,Not Ranked
None,October 17 2025,2025-06-20 23:59,Workshop on Human-Centered AI Privacy and Security,https://haips.com,HAIPS 2025,Co-located with ACM CCS 2025,"Taipei, Taiwan",Unknown,Not Ranked
None,October 13 2025,2025-07-01 23:59,Workshop on Re-design Industrial Control Systems with Security,https://ricssworkshop.github.io/,RICSS 2025,Co-located with ACM CCS 2025,"Taipei, Taiwan",Unknown,Not Ranked
None,October 14-17 2025,2025-07-30 23:59,Workshop on Blockchain for Decentralized Trust and Digital Identity,https://bcca-conference.org/2025/Workshops/b4ti.php,B4TI 2025,Co-located with BCCA 2025,"Dubrovnik, Croatia",Unknown,Not Ranked
None,October 13 2025,2025-07-07 23:59,Workshop on Software Understanding and Reverse Engineering,https://sure-workshop.org/,SURE 2025,Co-located with ACM CCS 2025,"Taipei, Taiwan",Unknown,Not Ranked
None,December 2-4 2026,2026-06-01 23:59,EAI International Conference on Wireless Internet,https://wicon.eai-conferences.org/2026/,WICON 2026,None,"Bratislava, Slovakia",Unknown,Not Ranked
None,December 4-5 2025,2025-10-20 23:59,EAI International Conference on Ad Hoc Networks,https://adhocnets.eai-conferences.org/2025/,ADHOCNETS 2025,None,"Istanbul, Turkey",Unknown,Not Ranked
None,April 27 2026,2026-02-03 23:59,European Workshop on Systems Security,https://eurosec-workshop.github.io/,EuroSec 2026,Co-located with ACM EuroSys 2026,"Edinburgh, UK",Unknown,Not Ranked
None,June 23-26 2026,2026-04-10 23:59,NextG Networks Cryptography and Security (NextG-Sec),https://nextg-sec.github.io/,NextG-Sec 2026,Co-located with ACNS 2026,"Stony Brook, New York, USA",Unknown,Not Ranked
None,May 10 2026,2026-02-01 23:59,Workshop on Migration and Agility in Cryptographic Systems,https://magics.cs.hs-rm.de,MAgiCS 2026,Co-located with EuroCrypt 2026,"Rome, Italy",UTC,Not Ranked
None,April 7 2026,2026-01-19 23:59,International Workshop on AI Safety and Security,https://cyber.kent.ac.uk/events/AI-SS2026/index.html,AI-SS 2026,Co-located with EDCC 2026 (21st European Dependable Computing Conference),"Canterbury, UK",UTC,Not Ranked
None,April 20-21 2026,2026-02-22 23:59,International Workshop on Trends in Digital Identity,https://st.fbk.eu/events/TDI2026/,TDI 2026,None,"Verona, Italy",Unknown,Not Ranked
None,"May 21, 2026 2026",2026-02-20 23:59,The 1st Workshop on Datasets for Software Security,https://data4softsec26.ieee-security.org,Data4SoftSec 2026,Co-located with IEEE S&P 2026,"San Francisco, California, USA",UTC,Not Ranked
None,May 24-28 2026,2026-01-31 23:59,Workshop on Cybersecurity of Digital Twins and Interconnected Cyber Physical Systems,https://seccps.github.io/,SecCPS 2026,Co-located with IEEE ICC 2026,"Glasgow, UK",Unknown,Not Ranked
None,"May 21, 2026 2026",2026-02-19 23:59,Workshop on Metascience and Critical Reflections in Security & Privacy,https://metacrisp.org,MetaCRiSP 2026,Co-located with IEEE S&P 2026,"San Francisco, California, USA",Unknown,Not Ranked
None,July 10 2025,2026-3-12 23:59,Workshop on Automotive Cyber-Security,https://acsw.unimore.it/,ACSW 2025,Co-Located with IEEE European Symposium on Security and Privacy,"Lisbon, Portugal",Unknown,Not Ranked
None,July 04 2025,2025-03-23 23:59,Workshop on Operating Systems and Virtualization Security,https://osvs.pages.dev,OSVS 2025,Co-located with IEEE Euro S&P,"Venice, Italy",Unknown,Not Ranked
None,February 28 2025,2025-01-10 23:59,Workshop on Innovation in Metadata Privacy---Analysis and Construction Techniques,https://www.ndss-symposium.org/ndss2025/co-located-events/impact/,IMPACT 2025,Co-located with NDSS Symposium,"San Diego, California, USA",Unknown,Not Ranked
None,August 24-27 2026,2026-05-18 23:59,International Workshop on Emerging Digital Identities,https://www.ares-conference.eu/edid,EDId 2026,Co-located with ARES,"Linköping, SE",Unknown,Not Ranked
None,August 24-27 2026,2026-04-15 23:59,International Workshop on Digital Forensics,https://www.ares-conference.eu/wsdf,WSDF 2026,Co-located with ARES,"Linköping, SE",Unknown,Not Ranked
None,August 24-27 2026,2026-05-18 23:59,"Workshop on Security, Availability, and Fault-Tolerance in Edge AI Systems",https://www.ares-conference.eu/safe-edge,SAFE-EDGE 2026,Co-located with ARES,"Linköping, SE",Unknown,Not Ranked
None,August 24-27 2026,2026-05-18 23:59,International Workshop on Security of Mobile Applications,https://www.ares-conference.eu/iwsma,IWSMA 2026,Co-located with ARES,"Linköping, SE",Unknown,Not Ranked
None,August 24-27 2026,2026-05-18 23:59,Workshop on Quantum Computing for Securing Large Language Models,https://www.ares-conference.eu/qcllm,QCLLM 2026,Co-located with ARES,"Linköping, SE",Unknown,Not Ranked
None,August 24-27 2026,2026-05-18 23:59,Workshop on Advances in Secure Software Deployments,https://www.ares-conference.eu/asod,ASOD 2026,Co-located with ARES,"Linköping, SE",Unknown,Not Ranked
None,August 24-27 2026,2026-04-15 23:59,"International Workshop on Artificial Intelligence, Cyber and Cyber-Physical Security",https://www.ares-conference.eu/aiccps,AI&CCPS 2026,Co-located with ARES,"Linköping, SE",Unknown,Not Ranked
None,August 24-27 2026,2026-05-01 23:59,International Workshop on Cybersecurity and Privacy Risk Assessments,https://www.ares-conference.eu/cpra,CPRA 2026,Co-located with ARES,"Linköping, SE",Unknown,Not Ranked
None,August 24-27 2026,2026-05-18 23:59,Workshop on Recent Advances in Cyber Situational Awareness and Data-Centric Approaches,https://www.ares-conference.eu/csa,CSA 2026,Co-located with ARES,"Linköping, SE",Unknown,Not Ranked
None,August 24-27 2026,2026-05-08 23:59,International Workshop on Cyber Use of Information Hiding,https://www.ares-conference.eu/cuing,CUING 2026,Co-located with ARES,"Linköping, SE",Unknown,Not Ranked
None,August 24-27 2026,2026-05-04 23:59,International Workshop on Applied Trust and Cyber Resilience,https://www.ares-conference.eu/cyrestrust,CyResTrust 2026,Co-located with ARES,"Linköping, SE",Unknown,Not Ranked
None,August 24-27 2026,2026-05-11 23:59,International Workshop on Graph-based Approaches for CyberSecurity,https://www.ares-conference.eu/grasec,GRASEC 2026,Co-located with ARES,"Linköping, SE",Unknown,Not Ranked
None,August 24-27 2026,2026-05-11 23:59,International Workshop on Cyber Crime,https://www.ares-conference.eu/iwcc,IWCC 2026,Co-located with ARES,"Linköping, SE",Unknown,Not Ranked
None,August 24-27 2026,2026-05-18 23:59,International Workshop on Post-Quantum Cybersecurity Readiness and Migration,https://www.ares-conference.eu/pq-readysec,PQ-ReadySec 2026,Co-located with ARES,"Linköping, SE",Unknown,Not Ranked
None,August 24-27 2026,2026-05-18 23:59,"International Workshop on Responsible Data Governance, Privacy, and Digital Transformation",https://www.ares-conference.eu/rdgpt,RDGPT 2026,Co-located with ARES,"Linköping, SE",Unknown,Not Ranked
None,August 24-27 2026,2026-05-04 23:59,Workshop on Sustainable Security And Awareness For Next Generation Infrastructures,https://www.ares-conference.eu/safer,SAFER 2026,Co-located with ARES,"Linköping, SE",Unknown,Not Ranked
None,August 24-27 2026,2026-05-18 23:59,International Workshop on Supply Chain Cyber Security,https://www.ares-conference.eu/sccs,SCCS 2026,Co-located with ARES,"Linköping, SE",Unknown,Not Ranked
None,August 24-27 2026,2026-05-15 23:59,Workshop on Cybersecurity in Healthcare Operations,https://www.ares-conference.eu/sechealth,SecHealth 2026,Co-located with ARES,"Linköping, SE",Unknown,Not Ranked
None,August 24-27 2026,2026-05-05 23:59,Workshop on Cybersecurity in Industry 4.0 and Beyond,https://www.ares-conference.eu/secindustry,Secdustry 2026,Co-located with ARES,"Linköping, SE",Unknown,Not Ranked
None,August 24-27 2026,2026-05-01 23:59,"International Workshop on Trust, Privacy and Security in the Digital Society",https://www.ares-conference.eu/trustbus,TrustBus 2026,Co-located with ARES,"Linköping, SE",Unknown,Not Ranked
None,August 24-27 2026,2026-05-18 23:59,Workshop on Security in Aviation,https://www.ares-conference.eu/sia,SIA 2026,Co-located with ARES,"Linköping, SE",Unknown,Not Ranked
None,August 24-27 2026,2026-05-18 23:59,International Workshop on Security and/or Privacy Enhancing Technologies for Multimodal Data,https://www.ares-conference.eu/spetvid,SPETViD 2026,Co-located with ARES,"Linköping, SE",Unknown,Not Ranked
None,May 18 - 22 2026,2026-02-27 23:59,"International Workshop on Secure, Accountable, and Verifiable Machine Learning",https://conf.researchr.org/home/icst-2026/safe-ml-2026,SAFE-ML 2026,Co-located with ICST,"Daejeon, South Korea",Unknown,Not Ranked
None,September 01-03 2025,2025-04-18 23:59,International Workshop on Lightweight Cryptography for Security and Privacy,https://www.encrypt-on.com/activities/conferences/lightsec-2025/,LightSEC 2025,None,"Istanbul, Turkiye",Unknown,Not Ranked
None,May 23 2025,2025-01-31 23:59,IFIP International Workshop on Network and Distributed Systems Security,https://ifiptc11.org/wg114-events/wg114-workshop,IFIP WNDSS 2025,None,"Maribor, Slovenia",Unknown,Not Ranked
None,May 6 2025,2025-02-08 23:59,International Workshop on Security and Privacy of Sensing Systems,https://emtechlab.github.io/sensors-security-privacy-workshop/,Sensors S&P 2025,Co-located with Sensys at Cyber-Physical Systems and Internet-of-Things Week,"Irvine, USA",Unknown,Not Ranked
None,October 13 2025,2025-07-04 23:59,Workshop on Programming Languages and Analysis for Security,https://plas25.github.io/,PLAS 2025,Co-located with CCS 2025,"Taipei, Taiwan",Unknown,Not Ranked
None,August 10-14 2026,2026-04-30 23:59,IFIP Summer School on Privacy and Identity Management,https://ifip-summerschool.org/,IFIPSC 2026,"Abstract submission. Once accepted, full papers due July 30.","Leuven, Belgium",Unknown,Not Ranked
"Jan 07, Apr 22",November 15-19 2026,2026-01-14 23:59,ACM Conference on Computer and Communications Security,https://www.sigsac.org/ccs/CCS2026/,ACM CCS 2026,"2 deadlines. Notifications - April 09, July 17.","The Hague, Netherlands",Unknown,A*
"Jan 07, Apr 22",November 15-19 2026,2026-04-29 23:59,ACM Conference on Computer and Communications Security,https://www.sigsac.org/ccs/CCS2026/,ACM CCS 2026,"2 deadlines. Notifications - April 09, July 17.","The Hague, Netherlands",Unknown,A*
None,June 22-26 2026,2025-11-04 19:59,ACM Symposium on Theory of Computing,https://acm-stoc.org/stoc2026/,ACM STOC 2026,Notification - February 01.,"Salt Lake City, Utah, USA",Unknown,A*
None,August 17-20 2026,2026-02-12 23:59,International Cryptology Conference,https://crypto.iacr.org/2026,CRYPTO 2026,Notification - May 04. Early reject - April 07.,"Santa Barbara, USA",PT,A*
None,May 10-14 2026,2025-10-02 23:59,European Cryptology Conference,https://eurocrypt.iacr.org/2026/,EUROCRYPT 2026,"Early Reject - December 08, Notification - January 31.","Rome, Italy",Unknown,A*
None,November 08-11 2026,2026-04-01 16:59,IEEE Symposium on Foundations of Computer Science,https://focs.computer.org/2026/,IEEE FOCS 2026,Notification - July 3.,"New York, USA",EDT,A*
July 17,May 17-20 2027,2026-07-24 23:59,IEEE International Conference on Computer Communications,https://infocom2027.ieee-infocom.org,IEEE INFOCOM 2027,Notification - December 01.,"Honolulu, Hawai",Unknown,A*
"May 29, November 6",May 18–21 2027,2026-06-05 23:59,IEEE Symposium on Security and Privacy,https://sp2027.ieee-security.org/,IEEE S&P (Oakland) 2027,"Early Reject -  July 21, January 19. Notification - September 09, March 09.","San Francisco, California, USA",Unknown,A*
"May 29, November 6",May 18–21 2027,2026-11-13 23:59,IEEE Symposium on Security and Privacy,https://sp2027.ieee-security.org/,IEEE S&P (Oakland) 2027,"Early Reject -  July 21, January 19. Notification - September 09, March 09.","San Francisco, California, USA",Unknown,A*
None,TBA 2027,2026-05-06 23:59,Network and Distributed System Security Symposium,https://www.ndss-symposium.org/ndss2027/,NDSS 2027,"Early Reject - June 12, September 25. Notification - July 22 and November 04.",Outside US (TBA),Unknown,A*
None,TBA 2027,2026-08-19 23:59,Network and Distributed System Security Symposium,https://www.ndss-symposium.org/ndss2027/,NDSS 2027,"Early Reject - June 12, September 25. Notification - July 22 and November 04.",Outside US (TBA),Unknown,A*
February 11,June 06-10 2026,2026-02-16 23:59,ACM Symposium on Principles of Distributed Computing,https://www.podc.org/podc2026/,ACM PODC 2026,Notification - April 29. Includes Brief Announcements.,"Egham, England",Unknown,A*
"May 23, December 03",June 13-19 2027,2026-05-30 23:59,Principles of Database Systems Symposium,https://2027.sigmod.org,ACM SIGMOD+PODS (PODS) 2027,"Notification - September 01, March 01. Data Privacy.","Huntington Beach, CA, USA",Unknown,A*
"May 23, December 03",June 13-19 2027,2026-12-10 23:59,Principles of Database Systems Symposium,https://2027.sigmod.org,ACM SIGMOD+PODS (PODS) 2027,"Notification - September 01, March 01. Data Privacy.","Huntington Beach, CA, USA",Unknown,A*
"January 10, April 10, July 10, October 10",June 13-19 2027,2026-01-17 23:59,ACM Special Interest Group on Management of Data Conference,https://2027.sigmod.org,ACM SIGMOD+PODS (SIGMOD) 2027,"Notification - June 02, September 02, December 02, March 02. Data Privacy, Differential Privacy, Industrial Track.","Huntington Beach, CA, USA",Unknown,A*
"January 10, April 10, July 10, October 10",June 13-19 2027,2026-04-17 23:59,ACM Special Interest Group on Management of Data Conference,https://2027.sigmod.org,ACM SIGMOD+PODS (SIGMOD) 2027,"Notification - June 02, September 02, December 02, March 02. Data Privacy, Differential Privacy, Industrial Track.","Huntington Beach, CA, USA",Unknown,A*
"January 10, April 10, July 10, October 10",June 13-19 2027,2026-08-17 23:59,ACM Special Interest Group on Management of Data Conference,https://2027.sigmod.org,ACM SIGMOD+PODS (SIGMOD) 2027,"Notification - June 02, September 02, December 02, March 02. Data Privacy, Differential Privacy, Industrial Track.","Huntington Beach, CA, USA",Unknown,A*
"January 10, April 10, July 10, October 10",June 13-19 2027,2026-10-17 23:59,ACM Special Interest Group on Management of Data Conference,https://2027.sigmod.org,ACM SIGMOD+PODS (SIGMOD) 2027,"Notification - June 02, September 02, December 02, March 02. Data Privacy, Differential Privacy, Industrial Track.","Huntington Beach, CA, USA",Unknown,A*
"August 18, January 19",August 11-13 2027,2026-08-25 23:59,Usenix Security Symposium,https://www.usenix.org/conference/usenixsecurity27,USENIX Security 2027,"Early Reject - October 07, March 17. Notification - December 04, May 14. No major revision, but two week shepherding.","Denver, CO, USA",Unknown,A*
"August 18, January 19",August 11-13 2027,2027-01-26 23:59,Usenix Security Symposium,https://www.usenix.org/conference/usenixsecurity27,USENIX Security 2027,"Early Reject - October 07, March 17. Notification - December 04, May 14. No major revision, but two week shepherding.","Denver, CO, USA",Unknown,A*
September 30,June 29 - July 03 2026,2025-10-07 23:59,The Web Conference (WWW),https://www2026.thewebconf.org,The Web Conference 2026,Notification - January 13. Has industry track.,"Dubai, UAE",Unknown,A*
None,August 31 - September 04 2026,2025-04-01 16:59,International Conference on Very Large Data Bases,https://vldb.org/2026/,VLDB 2026,Rolling deadline every month. Notification on 15th of next month. Multiple tracks.,"Boston, MA, USA",PT,A*
