abstract_deadline,date,deadline,full_name,link,name,note,location,timezone,rank
None,May 18-21 2026,2025-06-05 23:59,IEEE Symposium on Security and Privacy,https://sp2026.ieee-security.org/,S&P (Oakland) 2026,Abstract registration required (1 week before deadline AoE).,"San Francisco, California, USA",Unknown,TOP4
None,May 18-21 2026,2025-11-13 23:59,IEEE Symposium on Security and Privacy,https://sp2026.ieee-security.org/,S&P (Oakland) 2026,Abstract registration required (1 week before deadline AoE).,"San Francisco, California, USA",Unknown,TOP4
None,November 15-19 2026,2026-01-14 23:59,ACM Conference on Computer and Communications Security,https://www.sigsac.org/ccs/CCS2026,CCS 2026,Abstract registration required (1 week before deadline AoE).,"The Hague, The Netherlands",Unknown,TOP4
None,November 15-19 2026,2026-04-29 23:59,ACM Conference on Computer and Communications Security,https://www.sigsac.org/ccs/CCS2026,CCS 2026,Abstract registration required (1 week before deadline AoE).,"The Hague, The Netherlands",Unknown,TOP4
None,August 11-13 2027,2026-08-25 23:59,USENIX Security Symposium,https://www.usenix.org/conference/usenixsecurity27,USENIX Security 2027,Abstract registration required (1 week before deadline AoE).,"Denver, CO, USA",Unknown,TOP4
None,August 11-13 2027,2027-01-26 23:59,USENIX Security Symposium,https://www.usenix.org/conference/usenixsecurity27,USENIX Security 2027,Abstract registration required (1 week before deadline AoE).,"Denver, CO, USA",Unknown,TOP4
None,TBD 2027,2026-05-06 23:59,ISOC Network and Distributed System Security Symposium,https://www.ndss-symposium.org/ndss2027/submissions/call-for-papers/,NDSS 2027,None,TBD,Unknown,TOP4
None,TBD 2027,2026-08-19 23:59,ISOC Network and Distributed System Security Symposium,https://www.ndss-symposium.org/ndss2027/submissions/call-for-papers/,NDSS 2027,None,TBD,Unknown,TOP4
None,September 14-18 2026,2026-01-09 23:59,European Symposium on Research in Computer Security,https://sites.google.com/di.uniroma1.it/esorics2026/,ESORICS 2026,None,"Rome, Italy",Unknown,A
None,September 14-18 2026,2026-04-21 23:59,European Symposium on Research in Computer Security,https://sites.google.com/di.uniroma1.it/esorics2026/,ESORICS 2026,None,"Rome, Italy",Unknown,A
None,July 12-16 2027,2026-08-21 23:59,ACM Asia Conference on Computer and Communications Security,https://asiaccs2027.cityu.edu.mo/home/index.html,AsiaCCS 2027,None,Macau,Unknown,A
None,July 12-16 2027,2026-12-11 23:59,ACM Asia Conference on Computer and Communications Security,https://asiaccs2027.cityu.edu.mo/home/index.html,AsiaCCS 2027,None,Macau,Unknown,A
None,July 6 - 10 2026,2025-11-20 23:59,IEEE European Symposium on Security and Privacy,https://eurosp2026.ieee-security.org/,Euro S&P 2026,Abstract registration required (1 week before deadline AoE).,"Lisbon, Portugal",Unknown,A
None,July 26-29 2026,2025-07-24 23:59,IEEE Computer Security Foundations Symposium,https://www.ieee-security.org/TC/CSF2026/,CSF 2026,None,"Lisbon, Portugal",Unknown,A
None,July 26-29 2026,2025-10-09 23:59,IEEE Computer Security Foundations Symposium,https://www.ieee-security.org/TC/CSF2026/,CSF 2026,None,"Lisbon, Portugal",Unknown,A
None,July 26-29 2026,2026-01-29 23:59,IEEE Computer Security Foundations Symposium,https://www.ieee-security.org/TC/CSF2026/,CSF 2026,None,"Lisbon, Portugal",Unknown,A
None,November 23-25 2026,2026-06-10 23:59,International Conference on Cryptology and Network Security,https://uow-ic2.github.io/cans2026/index.html,CANS 2026,None,"Wollongong, Australia",Unknown,B
None,June 30 - July 3 2026,2025-11-18 23:59,ACM Conference on Security and Privacy in Wireless and Mobile Networks,https://wisec26.events.cispa.de/,WiSec 2026,None,"Saarbrücken, Germany",Unknown,B
None,June 30 - July 3 2026,2026-03-03 23:59,ACM Conference on Security and Privacy in Wireless and Mobile Networks,https://wisec26.events.cispa.de/,WiSec 2026,None,"Saarbrücken, Germany",Unknown,B
None,June 9 - 11 2026,2025-12-19 23:59,IFIP International Information Security and Privacy Conference,https://ifipsec.org/cfp.html,IFIP SEC 2026,None,"Perth, Australia",Unknown,B
None,October 20-22 2025,2025-06-11 23:59,Information Security Conference,https://isc25.skku.edu/,ISC 2025,None,"Seoul, South Korea",Unknown,Not Ranked
None,November 14-17 2025,2025-08-01 23:59,"International Conference on Trust, Security and Privacy in Computing and Communications",https://ieee-aiplus-2025.org/trustcom.html,TrustCom 2025,None,"Guiyang, China",Unknown,B
None,November 25-27 2025,2025-09-15 23:59,International Symposium on Foundations & Practice of Security,https://hub.imt-atlantique.fr/fps2025/,FPS 2025,None,"Brest, France",Unknown,B
None,July 21-24 2026,2026-01-15 23:59,International Conference on Security and Privacy in Communication Networks,https://securecomm.eai-conferences.org/2026/,SecureComm 2026,None,"Lancaster, United Kingdom",Unknown,Not Ranked
None,October 9-11 2026,2026-03-31 23:59,"International Symposium on Stabilization, Safety, and Security of Distributed Systems",https://sss2026.conf.lip6.fr/,SSS 2026,None,"Gothenburg, Sweden",Unknown,Not Ranked
None,October 9-11 2026,2026-05-15 23:59,"International Symposium on Stabilization, Safety, and Security of Distributed Systems",https://sss2026.conf.lip6.fr/,SSS 2026,None,"Gothenburg, Sweden",Unknown,Not Ranked
None,October 9-11 2026,2026-07-15 23:59,"International Symposium on Stabilization, Safety, and Security of Distributed Systems",https://sss2026.conf.lip6.fr/,SSS 2026,None,"Gothenburg, Sweden",Unknown,Not Ranked
None,TBD 2027,1970-05-31 23:59,Privacy Enhancing Technologies Symposium,https://www.petsymposium.org/cfp26.php,PETS 2027,Rolling deadline every quarter,TBD,Unknown,A
None,TBD 2027,1970-08-31 23:59,Privacy Enhancing Technologies Symposium,https://www.petsymposium.org/cfp26.php,PETS 2027,Rolling deadline every quarter,TBD,Unknown,A
None,TBD 2027,1970-11-30 23:59,Privacy Enhancing Technologies Symposium,https://www.petsymposium.org/cfp26.php,PETS 2027,Rolling deadline every quarter,TBD,Unknown,A
None,TBD 2027,%y-02-28 23:59,Privacy Enhancing Technologies Symposium,https://www.petsymposium.org/cfp26.php,PETS 2027,Rolling deadline every quarter,TBD,Unknown,A
None,August 23-26 2026,2026-02-19 23:59,Symposium on Usable Privacy and Security,https://soups.page/,SOUPS 2026,Abstract registration required (1 week before deadline AoE).,"Hannover, Germany",Unknown,A
None,September 10-September 11 2025,2025-05-09 23:59,European Symposium on Usable Security,https://eurousec2025.cis.strath.ac.uk/,EuroUSEC 2025,Paper registration due May 5th AoE,"Manchester, UK",Unknown,Not Ranked
None,June 24-25 2026,2026-02-13 23:59,The Annual Symposium on Applications of Contextual Integrity,https://privaci.info/symposium/2026/cfp.html,PrivaCI 2026,None,"Urbana-Champaign, USA",Unknown,Not Ranked
None,August 26-28 2026,2026-04-28 23:59,"Annual International Conference on Privacy, Security, and Trust",https://pstnet.ca/pst2026,PST 2026,Co-located with SAC 2026.,"Ottawa, Canada",Unknown,Not Ranked
None,September 9-10 2026,2026-04-15 23:59,Annual Privacy Forum,https://privacyforum.eu/callforpapers.html,APF 2026,None,"Salzburg, Austria",Unknown,Not Ranked
None,August 17-20 2026,2026-02-12 23:59,International Cryptology Conference,https://crypto.iacr.org/2026/,Crypto 2026,None,"Santa Barbara, CA, USA",Etc/GMT+8,A*
None,May 10-14 2026,2025-10-02 23:59,European Cryptology Conference,https://eurocrypt.iacr.org/2026/,Eurocrypt 2026,None,"Rome, Italy",Unknown,A*
None,November 7-9 2026,2025-04-15 23:59,International Conference on Information Security and Cryptology,https://inscrypt2026.comp.polyu.edu.hk/,Inscrypt 2026,None,"Hong Kong SAR, China",Unknown,Not Ranked
None,November 7-9 2026,2025-06-15 23:59,International Conference on Information Security and Cryptology,https://inscrypt2026.comp.polyu.edu.hk/,Inscrypt 2026,None,"Hong Kong SAR, China",Unknown,Not Ranked
None,August 26-28 2026,2026-02-02 23:59,Selected Areas in Cryptography,https://sacworkshop.org/SAC26/,SAC 2026,None,"Ottawa, ON, Canada",Unknown,B
None,August 26-28 2026,2026-05-11 23:59,Selected Areas in Cryptography,https://sacworkshop.org/SAC26/,SAC 2026,None,"Ottawa, ON, Canada",Unknown,B
None,December 8-12 2025,2025-05-16 12:00,International Conference on the Theory and Application of Cryptology and Information Security,https://asiacrypt.iacr.org/2025/,Asiacrypt 2025,None,"Melbourne, Australia",Etc/GMT,A
None,March 2–6 2026,2025-09-20 23:59,Financial Cryptography and Data Security,https://fc26.ifca.ai,FC 2026,None,St. Kitts,Unknown,A
None,October 6–9 2026,2026-05-27 23:59,ACM Conference on Advances in Financial Technologies,https://aft.ifca.ai/aft26/CFP.html,AFT 2026,Abstract registration required (1 week before deadline AoE).,"London, UK",Unknown,B
None,November 10-13 2026,2026-05-19 23:59,Theory of Cryptography Conference,https://tcc.iacr.org/2026/,TCC 2026,None,"New York City, USA",Unknown,B
None,May 25-28 2026,2025-10-24 09:59,International Conference on Practice and Theory of Public Key Cryptography,https://pkc.iacr.org/2026/,PKC 2026,None,"West Palm Beach, FL, USA",Unknown,B
None,March 23-26 2026,2025-10-24 23:59,RSA Conference Cryptographers’ Track,https://conference.wsu.edu/ct-rsa-2026/,CT-RSA 2026,None,"San Francisco, CA, USA",Unknown,B
None,July 16-18 2026,2026-03-03 23:59,International Conference on Security and Cryptography,https://secrypt.scitevents.org,SECRYPT 2026,None,"Porto, Portugal",Unknown,Not Ranked
None,July 16-18 2026,2026-04-16 23:59,International Conference on Security and Cryptography,https://secrypt.scitevents.org,SECRYPT 2026,None,"Porto, Portugal",Unknown,Not Ranked
None,July 08-10 2026,2026-03-01 23:59,International Conference on Cryptography Africa,https://www.africacrypt2026.tn/,AfricaCrypt 2026,None,"Hammamet, Tunisia",Unknown,Not Ranked
None,October 1-3 2025,2025-05-16 23:59,International Conference on Cryptology and Information Security in Latin America,https://ciencias.medellin.unal.edu.co/eventos/latincrypt/,LATINCRYPT 2025,Extended submission deadline May 16th 23:59 AoE,"Medellin, Colombia",Unknown,Not Ranked
None,TBD 2027,1970-03-01 23:59,IACR Transactions on Symmetric Cryptology,https://tosc.iacr.org/,FSE 2027,Rolling deadline every quarter,TBD,Unknown,B
None,TBD 2027,1970-06-01 23:59,IACR Transactions on Symmetric Cryptology,https://tosc.iacr.org/,FSE 2027,Rolling deadline every quarter,TBD,Unknown,B
None,TBD 2027,1970-09-01 23:59,IACR Transactions on Symmetric Cryptology,https://tosc.iacr.org/,FSE 2027,Rolling deadline every quarter,TBD,Unknown,B
None,TBD 2027,1970-11-23 23:59,IACR Transactions on Symmetric Cryptology,https://tosc.iacr.org/,FSE 2027,Rolling deadline every quarter,TBD,Unknown,B
None,October 11-15 2026,1970-07-15 23:59,IACR Transactions on Cryptographic Hardware and Embedded Systems,https://ches.iacr.org/2026/,CHES 2026,Rolling deadline every quarter,"Antalya, Türkiye",Unknown,A
None,October 11-15 2026,1970-10-15 23:59,IACR Transactions on Cryptographic Hardware and Embedded Systems,https://ches.iacr.org/2026/,CHES 2026,Rolling deadline every quarter,"Antalya, Türkiye",Unknown,A
None,October 11-15 2026,%y-01-15 23:59,IACR Transactions on Cryptographic Hardware and Embedded Systems,https://ches.iacr.org/2026/,CHES 2026,Rolling deadline every quarter,"Antalya, Türkiye",Unknown,A
None,October 11-15 2026,%y-04-15 23:59,IACR Transactions on Cryptographic Hardware and Embedded Systems,https://ches.iacr.org/2026/,CHES 2026,Rolling deadline every quarter,"Antalya, Türkiye",Unknown,A
None,December 15-16 2026,2026-07-31 23:59,IMA International Conference on Cryptography and Coding,https://ima.org.uk/28271/20th-ima-international-conference-on-cryptography-and-coding/,C&C 2026,None,"Cirencester, UK",Unknown,Not Ranked
None,October 11-14 2026,2026-04-16 23:59,"International Symposium on Research in Attacks, Intrusions and Defenses",https://raid2026.org,RAID 2026,None,"Lancaster, UK",Unknown,A
None,March 23-27 2026,2025-10-17 23:59,ACM/SIGAPP Symposium On Applied Computing,https://www.sigapp.org/sac/sac2026/,SAC 2026,None,"Thessaloniki, Greece",Unknown,Not Ranked
None,Dec 7-11 2026,2026-05-26 23:59,Annual Computer Security Applications Conference,https://www.acsac.org/2026/submissions/papers/,ACSAC 2026,None,"Los Angeles, CA, USA",Unknown,A
None,June 22-25 2026,2025-12-04 23:59,The International Conference on Dependable Systems and Networks,https://dsn2026.github.io/,DSN 2026,Abstract registration required (1 week before deadline AoE).,"Charlotte, NC, USA",Unknown,A
None,June 22-25 2026,2025-09-25 23:59,International Conference on Applied Cryptography and Network Security,https://acns2026.github.io/,ACNS 2026,None,"New York, NY",Unknown,B
None,June 22-25 2026,2026-01-23 23:59,International Conference on Applied Cryptography and Network Security,https://acns2026.github.io/,ACNS 2026,None,"New York, NY",Unknown,B
None,July 01-03 2026,2025-12-03 23:59,The Conference on Detection of Intrusions and Malware & Vulnerability Assessment,https://www.dimva.org/dimva2026/,DIMVA 2026,None,"Chania, Greece",Unknown,B
None,July 01-03 2026,2026-02-11 23:59,The Conference on Detection of Intrusions and Malware & Vulnerability Assessment,https://www.dimva.org/dimva2026/,DIMVA 2026,None,"Chania, Greece",Unknown,B
None,July 8-10 2026,2025-10-27 23:59,ACM Symposium on Access Control Models and Technologies,https://www.sacmat.org/2026/,SACMAT 2026,None,"Waterloo, Canada",Unknown,Not Ranked
None,July 8-10 2026,2026-03-06 23:59,ACM Symposium on Access Control Models and Technologies,https://www.sacmat.org/2026/,SACMAT 2026,None,"Waterloo, Canada",Unknown,Not Ranked
None,August 24–27 2026,2026-03-09 23:59,"International Conference on Availability, Reliability and Security",https://www.ares-conference.eu/,ARES 2026,"Abstract registration deadline March 2, 2026.","Linköping, Sweden",Unknown,B
None,June 23-25 2026,2026-01-02 23:59,ACM Conference on Data and Application Security and Privacy,http://www.codaspy.org/2026/,CODASPY 2026,Abstract registration required (1 week before deadline AoE).,"Frankfurt am Main, Germany",Unknown,Not Ranked
None,July 28-30 2026,2025-03-27 23:59,Conference on Data and Applications Security and Privacy,https://dbsec2026.gmu.edu/,DBSec 2026,None,"Arlington, Virginia, USA",Unknown,B
None,April 13-17 2026,2025-10-07 23:59,International Conference on the World Wide Web,https://www2026.thewebconf.org,The Web Conference 2026,Abstract deadline September 30 AoE.,"Dubai, United Arab Emirates",Unknown,A*
None,November 15-18 2026,2026-06-10 23:59,ACM SIGOPS Annual Technical Conference,https://sigops.org/s/conferences/atc/2026/index.html,ATC 2026,None,"Shatin, Hong Kong",Unknown,A
None,November 2-6 2026,2026-05-30 23:59,The Symposium on Electronic Crime Research,https://apwg.org/events/ecrime2026,eCrime 2026,None,"Lisbon, Portugal",Unknown,Not Ranked
None,March 23-25 2026,2025-10-08 23:59,Passive and Active Measurement Conference,https://pam2026.at/,PAM 2026,Abstract registration required (1 week before deadline AoE).,Virtual,Unknown,B
None,August 10-11 2026,2026-02-24 23:59,USENIX Symposium on Vehicle Security and Privacy,https://www.usenix.org/conference/vehiclesec26,VehicleSec 2026,Co-located with USENIX Security 2026,"Baltimore, USA",Unknown,Not Ranked
None,October 24-26 2024,2024-08-04 23:59,International Symposium on Network Computing and Applications,https://www.nca-ieee.org/2024/index.html,NCA 2024,None,"Bertinoro, Italy",Unknown,B
None,October 22-24 2025,2025-07-15 23:59,International Conference on Risks and Security of Internet and Systems,https://crisis2025.uqo.ca,CRISIS 2025,None,"Gatineau, Canada",Unknown,Not Ranked
None,October 10-12 2025,2025-05-31 23:59,International Conference on Provable and Practical Security,https://sulab-sever.u-aizu.ac.jp/provsec2025/index.html,ProvSec 2025,None,"Yokohama, Japan",Unknown,Not Ranked
None,November 3-6 2026,2025-11-20 23:59,ACM Internet Measurement Conference,https://conferences.sigcomm.org/imc/2026/,IMC 2026,Abstract registration required (1 week before deadline AoE).,"Karlsruhe, Germany",Unknown,A
None,November 3-6 2026,2026-04-29 23:59,ACM Internet Measurement Conference,https://conferences.sigcomm.org/imc/2026/,IMC 2026,Abstract registration required (1 week before deadline AoE).,"Karlsruhe, Germany",Unknown,A
None,May 4-7 2026,2025-08-26 23:59,IEEE International Symposium on Hardware Oriented Security and Trust,http://www.hostsymposium.org/,HOST 2026,Abstract registration required (1 week before deadline AoE).,"Washington DC, USA",Unknown,Not Ranked
None,May 4-7 2026,2025-12-08 23:59,IEEE International Symposium on Hardware Oriented Security and Trust,http://www.hostsymposium.org/,HOST 2026,Abstract registration required (1 week before deadline AoE).,"Washington DC, USA",Unknown,Not Ranked
None,December 11-13 2026,2026-07-14 23:59,Asian Hardware Oriented Security and Trust Symposium,https://www.asianhost.org/2026/,AsianHOST 2026,None,"Kharagpur, India",Asia/Shanghai,Not Ranked
None,March 30 - April 1 2026,2025-06-27 23:59,Constructive Approaches for Security Analysis and Design of Embedded Systems,https://cascade-conference.org/index.html,CASCADE 2026,None,"Regensburg, Germany",Unknown,Not Ranked
None,March 30 - April 1 2026,2025-12-05 23:59,Constructive Approaches for Security Analysis and Design of Embedded Systems,https://cascade-conference.org/index.html,CASCADE 2026,None,"Regensburg, Germany",Unknown,Not Ranked
None,April 25 - May 1 2027,2026-06-30 23:59,IEEE/ACM International Conference on Software Engineering,https://conf.researchr.org/home/icse-2027,ICSE 2027,Abstract registration required (1 week before deadline AoE).,"Dublin, Ireland",Unknown,A*
None,October 12 - 16 2026,2026-03-26 23:59,IEEE/ACM Automated Software Engineering,https://conf.researchr.org/home/ase-2026,ASE 2026,None,"Munich, Germany",Unknown,A*
None,July 12 - 16 2027,2026-10-09 23:59,ACM International Conference on the Foundations of Software Engineering,https://conf.researchr.org/home/fse-2026,ESEC/FSE 2027,None,"Shenzhen, China",Unknown,A*
None,October 3 - 9 2026,2026-01-29 23:59,ACM SIGSOFT International Symposium on Software Testing and Analysis,https://conf.researchr.org/home/issta-2026,ISSTA 2026,None,"Oakland, CA, USA",Unknown,Not Ranked
None,November 4 - 6 2025,2025-04-16 23:59,ESA Security for Space Systems Conference,https://security4space.esa.int/2025/cfp/,Security for Space Systems (3S) 2025,None,"ESTEC, Noordwijk, Netherlands",Unknown,Not Ranked
None,November 4 - 6 2025,2025-06-30 23:59,ESA Security for Space Systems Conference,https://security4space.esa.int/2025/cfp/,Security for Space Systems (3S) 2025,None,"ESTEC, Noordwijk, Netherlands",Unknown,Not Ranked
None,December 13-15 2026,2026-09-15 23:59,Security Standardisation Research Conference,https://ssresearch26.umbc.edu/,SSR 2026,None,"Baltimore, MD, USA",Unknown,Not Ranked
None,January 29-30 2024,2023-11-05 23:59,IEEE International Symposium on Secure and Private Execution Environment Design,https://seed-symposium.org/2024/,SEED 2024,None,"Orlando, FL",Unknown,Not Ranked
None,Nov 20-22 2024,2024-07-01 23:59,International Conference on Network and System Security and International Symposium on Security and Privacy in Social Networks and Big Data,http://nsclab.org/nss-socialsec2024/index.html,NSS-SocialSec 2024,None,"Abu Dhabi, UAE",Unknown,Not Ranked
None,September 15–16 2026,2025-04-20 23:59,International Conference on IT Security Incident Management and IT Forensics,https://www.imf-conference.org/cfp.html,IMF 2026,None,"Bonn, Germany",Etc/UTC,Not Ranked
None,May 29-31 2026,2026-03-31 23:59,International Conference on Science of Cyber Security,https://scisec.org/,SciSec 2026,None,"Beijing, China",Unknown,Not Ranked
None,"Sep 2-3, 2026 2026",2026-04-13 23:59,International Conference on Design of Cyber-Secure Critical Infrastructure,https://dcs-ci.github.io,DCS-CI 2026,None,"Buford, Georgia, USA",Unknown,Not Ranked
None,September 2-3 2026,2026-05-25 23:59,Conference on Sociotechnical Cybersecurity and Privacy,https://scpconf.eu/,SCP 2026,Abstract registration required (May 20 AoE).,"Belval, Luxembourg",Unknown,Not Ranked
None,July 6-9 2026,2025-11-27 23:59,Australasian Conference on Information Security and Privacy,https://acisp.org/,ACISP 2026,None,"Perth, Australia",Unknown,Not Ranked
None,July 6-9 2026,2026-02-26 23:59,Australasian Conference on Information Security and Privacy,https://acisp.org/,ACISP 2026,None,"Perth, Australia",Unknown,Not Ranked
None,February 3-8 2025,2024-12-09 23:59,Italian Conference on Cybersecurity,https://itasec.it/,ITASEC 2025,None,"Bologna, IT",Unknown,Not Ranked
None,September 15-18 2026,2026-04-15 23:59,Intelligent Cybersecurity Conference,https://icsc-conference.org/2026/,ICSC 2026,None,"Abu Dhabi, UAE",Unknown,Not Ranked
None,October 27-30 2026,2026-02-28 23:59,International Conference on Information and Communications Security,https://sulab-sever.u-aizu.ac.jp/icics2026/index.html,ICICS 2026,None,"Fukui, Japan",Asia/Tokyo,Not Ranked
None,October 27-30 2026,2026-05-23 23:59,International Conference on Information and Communications Security,https://sulab-sever.u-aizu.ac.jp/icics2026/index.html,ICICS 2026,None,"Fukui, Japan",Asia/Tokyo,Not Ranked
None,March 23-25 2026,2025-09-24 23:59,IEEE Conference on Secure and Trustworthy Machine Learning,https://satml.org/,SaTML 2026,None,"Munich, Germany",Unknown,Not Ranked
None,November 12-13 2025,2025-08-17 23:59,Nordic Conference on Secure IT Systems,https://nordsec2025.cs.ut.ee/,NordSec 2025,None,"Tartu, Estonia",Unknown,Not Ranked
None,July 5-6 2026,2026-02-05 23:59,Secure Development Conference,https://conf.researchr.org/home/secdev-2026,SecDev 2026,None,"Montreal, Canada",Unknown,Not Ranked
None,June 1 2026,2026-03-16 23:59,Workshop on Trustworthy AI for IoMT (Internet of Medical Things),https://trustai2026.web.illinois.edu/,TRUST-AI 2026,Co-located with IEEE ICHI 2026.,"Minneapolis, MN, USA",Unknown,Not Ranked
None,June 25 2026,2026-03-14 23:59,ACNS Workshop on Artificial Intelligence in Hardware Security,http://aihws2026.aisylab.com/,AIHWS 2026,In conjunction with ACNS 2026,"Stony Brook, New York, USA",Unknown,Not Ranked
None,June 22 2026,2026-01-30 23:59,International Workshop on Artificial Intelligence and IoT Security,https://aiots26.github.io/main/,AIoTS 2026,In conjunction with ACNS 2026,"Stony Brook, NY, USA",Unknown,Not Ranked
None,June 22 2026,2026-03-13 23:59,International Workshop on Artificial Intelligence and IoT Security,https://aiots26.github.io/main/,AIoTS 2026,In conjunction with ACNS 2026,"Stony Brook, NY, USA",Unknown,Not Ranked
None,June 22-25 2026,2026-01-30 23:59,International Workshop on Critical Infrastructure and Maritime Systems Security,https://cimss2026.github.io/,CIMSS 2026,In conjunction with ACNS,"Stony Brook University, NY, USA",Unknown,Not Ranked
None,June 22-25 2026,2026-03-22 23:59,International Workshop on Critical Infrastructure and Maritime Systems Security,https://cimss2026.github.io/,CIMSS 2026,In conjunction with ACNS,"Stony Brook University, NY, USA",Unknown,Not Ranked
None,June 2026 2026,2026-03-20 23:59,ACNS Workshop on Intelligent and Secure Computing,https://acns-isc.github.io/2026/index.html,ACNS-ISC 2026,In conjunction with ACNS 2026,"Stony Brook University, NY, USA",Unknown,Not Ranked
None,June 24 2025,2025-03-15 23:59,ACNS Workshop on Secure Cryptographic Implementation,https://acns-sci.github.io/,SCI 2025,In conjunction with ACNS 2025,"Munich, Germany",Unknown,Not Ranked
None,June 22-25 2026,2026-03-20 23:59,International Workshop on Security in Machine Learning and its Applications,https://simlaacns.github.io/,SiMLA 2026,In conjunction with ACNS,"Stony Brook University, NY, USA",Unknown,Not Ranked
None,October 17 2025,2025-06-20 23:59,The Joint Workshop on CPS & IoT Security and Privacy,https://cpsiotsec2025.github.io/,CPSIoTSec 2025,In conjunction with ACM CCS 2025,"Taipei, Taiwan",Unknown,Not Ranked
None,"October 17, 2025 2025",2025-07-03 23:59,Workshop on Artificial Intelligence and Security,https://aisec.cc,AISec 2025,Co-located with ACM CCS 2025,"Taipei, Taiwan",Unknown,Not Ranked
None,June 22 2026,2026-04-05 23:59,ACM SIGEnergy Workshop on Cybersecurity and Privacy of Energy Systems,https://energysp.github.io/,EnergySP 2026,In conjunction with ACM eEnergy 2026,"Banff, Canada",Unknown,Not Ranked
None,June 30 2025,2025-02-20 23:59,Workshop on Rethinking Malware Analysis,https://worma.gitlab.io/2025/,WoRMA 2025,Co-located with IEEE Euro S&P,"Venice, Italy",Unknown,Not Ranked
None,April 27 2026,2026-02-07 23:59,Workshop on System Software for Trusted Execution,https://systex-workshop.github.io/2026/,SysTEX 2026,Co-located with EuroSys 2026,"Edinburgh, Scotland",Unknown,Not Ranked
None,December 10 2024,2024-09-12 23:59,Industrial Control System Security Workshop,https://www.acsac.org/2024/workshops/icss/,ICSS 2024,In conjunction with ACSAC,"Waikiki, Hawaii, USA",Unknown,Not Ranked
None,December 9 2024,2024-10-06 23:59,Workshop Encouraging Building Better Blockchain Security,https://www.acsac.org/2024/workshops/web3sec/,WEB3SEC 2024,In conjunction with ACSAC,"Waikiki, Hawaii, USA",Unknown,Not Ranked
None,October 17 2025,2025-07-03 23:59,Workshop on Recent Advances in Resilient and Trustworthy MAchine learning-driveN system,https://artman-workshop.gitlab.io/,ARTMAN 2025,In conjunction with CCS,"Taipei, Taiwan",Unknown,Not Ranked
None,October 13 2025,2025-07-07 23:59,Workshop on Privacy in the Electronic Society,http://jianying.space/WPES2025/,WPES 2025,In conjunction with ACM CCS,"Taipei, Taiwan",Unknown,Not Ranked
None,September 27 - 30 2026,2026-04-30 23:59,New Security Paradigms Workshop,https://www.nspw.org/2026/cfp,NSPW 2026,None,"Victoria, Canada",Unknown,Not Ranked
None,September 14 - 17 2026,2025-05-11 23:59,IEEE Conference on Communications and Network Security,https://cns2026.ieee-cns.org/,CNS 2026,None,"Newark, DE, USA",Unknown,Not Ranked
