abstract_deadline,date,deadline,full_name,link,name,note,location,timezone,rank
"August 19, December 01",May 04-07 2026,2025-12-08 23:59,IEEE International Symposium on Hardware Oriented Security and Trust,http://www.hostsymposium.org/index.php,IEEE HOST 2026,"Notification - October 07, January 31.","Washington DC, USA",Unknown,Not Ranked
"November 10, December 05",June 26-30 2027,2026-11-17 23:59,International Symposium on Computer Architecture,https://iscaconf.org/isca2027,ISCA 2027,Notification - March 27. December deadline for Industrial Track.,"Raleigh, NC",Unknown,A*
"November 10, December 05",June 26-30 2027,2026-12-12 23:59,International Symposium on Computer Architecture,https://iscaconf.org/isca2027,ISCA 2027,Notification - March 27. December deadline for Industrial Track.,"Raleigh, NC",Unknown,A*
None,June 24 2026,2026-02-27 23:59,CNIL-Inria Privacy Award,https://www.cnil.fr/en/launch-10th-edition-cnil-inria-privacy-award,CNIL-Inria Privacy Award 2026,For works published between January 2023 to 2026. Notification - June 01.,"Paris, France",Unknown,Not Ranked
None,June 24 2026,2026-03-22 23:59,CNIL-Inria Privacy Day,https://www.cnil.fr/en/call-papers-privacy-research-day-june-24th-2026-paris,CNIL-Inria Privacy Research Day 2026,"Recently published, multi-disciplinary. Notification - May 04.","Paris, France",Unknown,Not Ranked
None,December 08-12 2025,2025-09-17 23:59,ACSAC,https://www.acsac.org/2025/submissions/artifacts_competition/,Cybersecurity Artifacts Competition and Impact Award 2025,Cybersecurity artifacts published in all peer-reviewed venues. Notification - October 30.,"Honululu, Hawaii",Unknown,Not Ranked
None,August 12-14 2026,2026-03-31 23:59,Usenix Security Enigma Track,https://www.usenix.org/conference/usenixsecurity26/enigma-cfp,Enigma@USENIX Security 2026,Notification - May 13.,"Baltimore, MD, USA",Unknown,Not Ranked
None,May 18-21 2026,2026-02-24 23:59,IEEE,https://sp2026.ieee-security.org/nominations-cybersecurity-award.html,IEEE Cybersecurity Award for Practice 2026,None,"San Francisco, CA",Unknown,Not Ranked
None,May 12-15 2025,2025-05-12 16:59,IEEE Symposium on Security and Privacy,https://sp2025.ieee-security.org/cftalks.html,IEEE S&P Short Talk 2025,Primary deadline till May 02.,"San Francisco, California, USA",PDT,Not Ranked
None,June 30 2026,2026-01-05 23:59,The Web Conference (WWW),https://www2026.thewebconf.org/calls/phd-symposium.html,PhD Symposium at The Web Conference 2026,Notification - February 03. Has proceedings.,"Dubai, UAE",Unknown,Not Ranked
None,April 16-17 2026,2026-04-09 23:59,15th Privacy Enhancing Techniques Convention,https://fg-pet.gi.de/veranstaltung/15th-privacy-enhancing-techniques-convention,PET-CON 2026.1 2026,Free registration.,Karlsruhe Institute for Technology,Unknown,Not Ranked
None,,%y-12-31 23:59,ACM Transactions on Privacy and Security,https://dl.acm.org/journal/tops/author-guidelines,ACM TOPS 2026,Accepts submission throughout the year.,,Unknown,Not Ranked
None,,2026-02-02 23:59,Communications in Cryptology,https://cic.iacr.org,IACR CiC 2026,Notification in two months.,,Unknown,Not Ranked
None,,2026-04-27 23:59,Communications in Cryptology,https://cic.iacr.org,IACR CiC 2026,Notification in two months.,,Unknown,Not Ranked
None,,2026-07-27 23:59,Communications in Cryptology,https://cic.iacr.org,IACR CiC 2026,Notification in two months.,,Unknown,Not Ranked
None,,2026-10-26 23:59,Communications in Cryptology,https://cic.iacr.org,IACR CiC 2026,Notification in two months.,,Unknown,Not Ranked
None,,%y-12-31 23:59,Journal of Cryptology,https://www.iacr.org/jofc/,IACR JoC 2026,Accepts submission throughout the year.,,Unknown,Not Ranked
None,,%y-12-31 23:59,IEEE Transactions on Computers,https://www.computer.org/digital-library/journals/tc/call-for-papers-general-submissions,IEEE TC 2026,Accepts submission throughout the year.,,Unknown,Not Ranked
None,,%y-12-31 23:59,IEEE Transactions on Dependable and Secure Computing,https://www.computer.org/csdl/journal/tq/write-for-us/15068,IEEE TDSC 2026,Accepts submission throughout the year.,,Unknown,Not Ranked
None,,%y-12-31 23:59,IEEE Transactions on Information Forensics and Security,https://signalprocessingsociety.org/publications-resources/information-authors,IEEE TIFS 2026,Accepts submission throughout the year.,,Unknown,Not Ranked
None,,%y-12-31 23:59,IEEE Transactions on Parallel and Distributed Systems,https://www.computer.org/csdl/journal/td/,IEEE TPDS 2026,Accepts submission throughout the year.,,Unknown,Not Ranked
None,,%y-12-31 23:59,IEEE Transactions on Services Computing,https://www.computer.org/csdl/journal/sc,IEEE ToSC 2026,Accepts submission throughout the year.,,Unknown,Not Ranked
None,,%y-12-31 23:59,Journal of the ACM,https://dl.acm.org/journal/jacm,JACM 2026,Accepts submission throughout the year.,,Unknown,Not Ranked
None,,%y-12-31 23:59,Journal of Computer and System Sciences,https://www.elsevier.com/journals/journal-of-computer-and-system-sciences/0022-0000/guide-for-authors,JCSS 2026,Accepts submission throughout the year.,,Unknown,Not Ranked
None,,%y-12-31 23:59,Journal of Parallel and Distributed Computing,https://www.elsevier.com/journals/journal-of-parallel-and-distributed-computing/0743-7315/guide-for-authors,JPDC 2026,Accepts submission throughout the year.,,Unknown,Not Ranked
